{
  "$schema": "https://autotelic.dev/tackle/protocol/jig.config.json",
  "engines": [
    {
      "id": "plumb",
      "kind": "oxlint-plugin",
      "command": "oxlint",
      "config": ".oxlintrc.json",
      "args": ["--ignore-pattern", "examples/**"]
    },
    { "id": "joggle", "kind": "process", "command": "joggle", "config": "joggle.config.json" },
    { "id": "cutlist", "kind": "process", "command": "cutlist", "config": "cutlist.config.json" }
  ],
  "gate": { "mode": "all", "baseline": ".jig-baseline.json", "failOn": "any-new" },
  "report": { "format": "text", "maxWarnings": -1 },
  "agent": { "cookbook": "JIG.md", "onboarding": "ONBOARD.md" }
}
